{
  "schema_version": 1,
  "title": "Core Assurance Glossary",
  "description": "Canonical terms for FR, TBT, evidence, rulesets and assurance framework traceability.",
  "terms": [
    {
      "id": "fr",
      "canonical": "Functional Requirement",
      "abbreviation": "FR",
      "definition": "A project-owned requirement describing behaviour the application must provide. It is informed by standards and project context, then mapped to compliance ruleset rows and proven by one or more TBTs.",
      "domain": "core",
      "aliases": ["project requirement", "functional requirement"],
      "deprecated_aliases": ["functional rule"],
      "not": ["ASVS row", "NIST control", "scanner rule", "JSP-453 gate"],
      "related_terms": ["tbt", "evidence", "ruleset_row", "epic"],
      "schema_fields": ["frs[].id", "tbts[].proves"],
      "ui_label": "FR",
      "tooltip": "Project-owned functional requirement, proven by one or more TBTs."
    },
    {
      "id": "tbt",
      "canonical": "Test Basis",
      "abbreviation": "TBT",
      "definition": "A test, scanner, review or approval basis used to prove one or more Functional Requirements.",
      "domain": "traceability",
      "aliases": ["test basis", "assurance check", "test basis trace"],
      "not": ["FR", "evidence artifact", "compliance ruleset row"],
      "related_terms": ["fr", "evidence", "evidence_policy"],
      "schema_fields": ["tbts[].id", "tbts[].proves"],
      "ui_label": "TBT",
      "tooltip": "The basis for proving an FR, such as a test, scanner check, review or approval."
    },
    {
      "id": "evidence",
      "canonical": "Evidence",
      "definition": "Observed or reviewed proof produced by a TBT, such as a test result, scanner result, document excerpt, approval record or screenshot.",
      "domain": "evidence",
      "aliases": ["evidence artifact", "evidence result", "proof"],
      "not": ["test design", "implemented fix"],
      "related_terms": ["tbt", "result_status", "source_locator"],
      "schema_fields": ["evidence[].id", "evidence[].produced_by", "evidence[].result_status"],
      "ui_label": "Evidence",
      "tooltip": "Observed proof collected from a TBT."
    },
    {
      "id": "ruleset",
      "canonical": "Compliance Ruleset",
      "definition": "A collection of compliance rows or controls, such as ASVS, NIST 800-53, CIS, ISO 27001 or PCI-DSS.",
      "domain": "ruleset",
      "aliases": ["compliance framework", "standard", "control set"],
      "deprecated_aliases": ["framework"],
      "not": ["assurance framework", "JSP-453 process", "FR"],
      "related_terms": ["ruleset_row", "fr", "scope"],
      "schema_fields": ["satisfies[].ruleset", "na_rows[].ruleset", "scope"],
      "ui_label": "Ruleset",
      "tooltip": "Compliance standard or control set, such as ASVS or NIST."
    },
    {
      "id": "ruleset_row",
      "canonical": "Compliance Ruleset Row",
      "definition": "A single requirement, row or control inside a compliance ruleset.",
      "domain": "ruleset",
      "aliases": ["compliance row", "control", "standard row", "requirement row"],
      "not": ["FR", "TBT", "gate criterion"],
      "related_terms": ["ruleset", "fr"],
      "schema_fields": ["satisfies[].row", "requirements[].row"],
      "ui_label": "Ruleset row",
      "tooltip": "A single row or control from a compliance ruleset."
    },
    {
      "id": "assurance_framework",
      "canonical": "Assurance Framework",
      "definition": "A process framework such as JSP-453 that defines gates, roles, criteria, approvals, ceremonies and evidence expectations.",
      "domain": "assurance",
      "aliases": ["process framework", "assurance process"],
      "deprecated_aliases": ["framework"],
      "not": ["compliance ruleset", "ASVS", "NIST 800-53"],
      "related_terms": ["gate", "criterion", "role", "assurance_instance"],
      "schema_fields": ["assurance_framework"],
      "ui_label": "Assurance framework",
      "tooltip": "Process framework defining gates, roles, approvals and criteria."
    },
    {
      "id": "assurance_instance",
      "canonical": "Assurance Instance",
      "definition": "Project-specific state for an assurance framework, including role assignments, criterion mappings, waivers, approvals and gate decisions.",
      "domain": "assurance",
      "aliases": ["project assurance instance", "gate state"],
      "not": ["reusable assurance framework catalog", "ruleset snapshot"],
      "related_terms": ["assurance_framework", "gate", "criterion", "approval_status"],
      "schema_fields": ["criterion_mappings", "role_assignments"],
      "ui_label": "Assurance instance",
      "tooltip": "Project-specific evidence, approvals and mappings for an assurance framework."
    },
    {
      "id": "role",
      "canonical": "Role",
      "definition": "A party or responsibility group that must be involved in an assurance gate, such as owner, approver, consulted specialist or reviewer.",
      "domain": "assurance",
      "aliases": ["party", "stakeholder", "assurance role"],
      "not": ["user role", "application permission"],
      "related_terms": ["gate", "assurance_framework", "approval_status"],
      "schema_fields": ["roles[].id", "required_roles[].role", "role_assignments[].role"],
      "ui_label": "Role",
      "tooltip": "Party or responsibility group involved in passing an assurance gate."
    },
    {
      "id": "gate",
      "canonical": "Gate",
      "definition": "A decision point in an assurance framework that must meet criteria and receive required involvement before the process continues.",
      "domain": "assurance",
      "aliases": ["approval gate", "process gate"],
      "not": ["FR", "ruleset row"],
      "related_terms": ["criterion", "role", "readiness_status"],
      "schema_fields": ["gates[].id", "gates[].criteria"],
      "ui_label": "Gate",
      "tooltip": "Assurance decision point with required criteria, roles and evidence."
    },
    {
      "id": "criterion",
      "canonical": "Criterion",
      "definition": "A requirement within a gate that defines what must be true before the gate can pass.",
      "domain": "assurance",
      "aliases": ["gate criterion", "gate requirement"],
      "not": ["FR", "ruleset row"],
      "related_terms": ["gate", "evidence_policy", "assurance_instance"],
      "schema_fields": ["criteria[].id", "criteria[].requirements"],
      "ui_label": "Criterion",
      "tooltip": "A gate-level requirement used to decide readiness."
    },
    {
      "id": "epic",
      "canonical": "Epic",
      "definition": "A UI grouping for related Functional Requirements, usually derived from the FR category field.",
      "domain": "ui",
      "aliases": ["group", "category"],
      "not": ["FR", "gate"],
      "related_terms": ["fr"],
      "schema_fields": ["frs[].category"],
      "ui_label": "Epic",
      "tooltip": "Group of related FRs."
    },
    {
      "id": "scope",
      "canonical": "Scope",
      "definition": "Project-specific selection of applicable ruleset levels, baselines, profiles, included rows and excluded rows.",
      "domain": "ruleset",
      "aliases": ["ruleset scope", "applicability"],
      "not": ["assurance framework route", "scan target"],
      "related_terms": ["ruleset", "ruleset_row"],
      "schema_fields": ["scope", "scope.*.levels", "scope.*.include_rows", "scope.*.exclude_rows"],
      "ui_label": "Scope",
      "tooltip": "Applicable ruleset levels, profiles and row selections for this project."
    },
    {
      "id": "evidence_policy",
      "canonical": "Evidence Policy",
      "definition": "The rule that determines what evidence is sufficient for a TBT or gate criterion.",
      "domain": "evidence",
      "aliases": ["pass policy", "sufficiency policy"],
      "not": ["result status", "approval status"],
      "related_terms": ["tbt", "criterion", "result_status"],
      "schema_fields": ["tbts[].evidence_policy", "criteria[].evidence_policy"],
      "ui_label": "Evidence policy",
      "tooltip": "Rule for deciding whether evidence is sufficient."
    },
    {
      "id": "result_status",
      "canonical": "Evidence Result Status",
      "definition": "Observed result for a piece of evidence: passed, failed, missing, manual review or waived.",
      "domain": "status",
      "aliases": ["evidence status"],
      "not": ["lifecycle status", "approval status", "readiness status"],
      "related_terms": ["evidence"],
      "schema_fields": ["evidence[].result_status"],
      "ui_label": "Result",
      "tooltip": "Observed outcome for evidence."
    },
    {
      "id": "lifecycle_status",
      "canonical": "Lifecycle Status",
      "definition": "Authoring lifecycle for an FR or TBT, such as draft, in scope, planned, implemented, deferred, retired or deprecated.",
      "domain": "status",
      "aliases": ["definition status"],
      "not": ["evidence result", "approval status", "readiness status"],
      "related_terms": ["fr", "tbt"],
      "schema_fields": ["frs[].lifecycle_status", "tbts[].lifecycle_status"],
      "ui_label": "Lifecycle",
      "tooltip": "Authoring lifecycle of an FR or TBT."
    },
    {
      "id": "approval_status",
      "canonical": "Approval Status",
      "definition": "Human approval state, such as pending, approved, rejected or waived.",
      "domain": "status",
      "aliases": ["role approval status"],
      "not": ["evidence result", "readiness status"],
      "related_terms": ["gate", "assurance_instance"],
      "schema_fields": ["role_assignments[].approval_status"],
      "ui_label": "Approval",
      "tooltip": "Human approval or waiver state."
    },
    {
      "id": "readiness_status",
      "canonical": "Readiness Status",
      "definition": "Derived readiness for a gate or criterion, such as ready, blocked, partial, manual review or waived.",
      "domain": "status",
      "aliases": ["gate status", "criterion status"],